[
  {
    "event_timestamp": "2020-01-02T20:59:00+00:00",
    "session_date": "2020-01-02",
    "symbol": "SPY",
    "bid": "323.50",
    "ask": "323.70",
    "bid_size": 400,
    "ask_size": 350,
    "midpoint": "323.60",
    "relative_spread": "0.000618",
    "currency": "USD",
    "source": "databento",
    "source_dataset": "EQUS.MINI",
    "source_symbol": "SPY",
    "schema_version": "1.0"
  },
  {
    "event_timestamp": "2020-01-02T20:59:00+00:00",
    "session_date": "2020-01-02",
    "symbol": "SPY",
    "bid": "2.50",
    "ask": "2.50",
    "bid_size": 10,
    "ask_size": 12,
    "midpoint": "2.50",
    "relative_spread": "0",
    "currency": "USD",
    "source": "databento",
    "source_dataset": "EQUS.MINI",
    "source_symbol": "SPY",
    "schema_version": "1.0"
  }
]
